{
  "$schema": "../device.schema.json",
  "schemaVersion": 1,
  "deviceType": {
    "name": "TestDeviceType",
    "className": "TestDeviceType",
    "enumSymbol": null,
    "enumValue": 5
  },
  "implementation": {
    "header": "include/devices/TestDeviceType/TestDeviceType.hpp",
    "source": "src/device/TestDeviceType/TestDeviceType.cpp",
    "buildGuard": null,
    "dependencies": [],
    "manager": {
      "registered": false,
      "collection": null,
      "includedInDeviceCollection": false
    }
  },
  "lifecycle": {
    "init": { "actions": [] },
    "update": {
      "entryPoint": "cyclic",
      "schedule": {
        "mode": "not_registered",
        "internalTasks": []
      }
    }
  },
  "configuration": {
    "commonFields": [],
    "customBytes": []
  },
  "services": [
    {
      "name": "DEVSERVICE_ENABLE",
      "overload": "serviceCall_NoParams",
      "status": "placeholder",
      "parameters": []
    },
    {
      "name": "DEVSERVICE_DISABLE",
      "overload": "serviceCall_NoParams",
      "status": "placeholder",
      "parameters": []
    },
    {
      "name": "DEVSERVICE_SET_DATA",
      "overload": "serviceCall_1",
      "status": "placeholder",
      "parameters": [
        { "name": "data", "type": "uint8", "source": "ServiceParameters_set1.a" }
      ]
    }
  ],
  "state": {
    "enabledSemantics": "constant true",
    "descriptionCustomBytes": [],
    "httpFields": []
  },
  "ui": {
    "roomWidget": null,
    "controls": [],
    "readouts": []
  },
  "extendedMemory": {
    "required": false,
    "size": 0
  },
  "limitations": [
    "This class is test scaffolding and is not registered by DeviceManager.",
    "Type value 5 is outside the production DevType enumeration.",
    "Identifiers and description values are hard-coded.",
    "Placeholder service branches do not return an explicit success code."
  ]
}
